### ISSUE TITLE
Sysbox integration-tests failures due to interface's MTU mismatch

### ISSUE THREAD

**Issue by rodnymolina** [nestybox/sysbox#36]
Problem affects many of Sysbox's integration-testcases where large packet sizes need to be exchanged (e.g. docker pull). At this point is not clear if problem can be reproduced in regular system-containers (L1) and/or their child app containers.

At high-level problem's symptom is very obvious: network transactions initiated by an L2 sys-container (within sysbox's privileged test-cntr), that require exchange of large-size packets, can stall during  "docker pull" execution.

The following elements are required for problem to reproduce:

* host' egress-facing network iface (A) is configured with lower than expected MTU (1460 bytes) -- typical scenario in server farms.

* hosts' docker0 bridge iface (B) is configured with MTU of 1500 bytes.

* L1's egress-iface (C) is configured with MTU of 1500 bytes.

* L1's docker0 iface (D) is configured with MTU of 1500 bytes.

* IP packets generated from app-containers have "don't-fragment" (DF) bit set.

From a topological perspective, this is the path to be traversed by every packet generated within the L2 container:

```
data-center-fabric <--> host's egress-iface (A) <--> host's docker0 iface (B) <--> L1's egress-iface (C) <--> L1's docker0 iface (C) 
```
Notice that the MTU along this path is always 1500 bytes, except on the last network element (from L2's container perspective), where the MTU for A is 1460 bytes.

As per PMTU's ietf [specs](https://tools.ietf.org/html/rfc1191), upon arrival of a datagram with a size larger than the egress iface's MTU, if "DF" bit is set in its L3 header, this package must be dropped and an ICMP "Fragmentation Needed" message must be sent back to hint the origin about the need to reduce the packet size in subsequent attempts. The network-stack in origin, should then generate an entry to keep track of the discovered MTU value associated to the remote IP peer. At the same time, the network stack must notify the application of the need to adjust its PDU size. At this point the application typically opts by reducing the size of the subsequent packets so that these ones can now reach the remote end.

In our scenario, we expect interface B (host's docker0) to be the spot in which ICMP's fragmentation messages are generated, as this is the location where there's an MTU discrepancy. That's precisely what we observe during problem reproduction:

```
16:24:11.481123 IP 172.17.0.1 > 172.18.0.6: ICMP ec2-52-5-11-128.compute-1.amazonaws.com unreachable - need to frag (mtu 1460), length 556
16:24:11.551969 IP ec2-52-5-11-128.compute-1.amazonaws.com.https > 172.18.0.6.55310: Flags [.], ack 1587, win 119, options [nop,nop,TS val 4082793925 ecr 1493915319], length 0
16:24:11.632656 IP 172.18.0.6.55310 > ec2-52-5-11-128.compute-1.amazonaws.com.https: Flags [P.], seq 3035:3104, ack 5326, win 501, options [nop,nop,TS val 1493915471 ecr 4082793925], length 69
16:24:11.662150 IP ec2-52-5-11-128.compute-1.amazonaws.com.https > 172.18.0.6.55310: Flags [.], ack 1587, win 128, options [nop,nop,TS val 4082794035 ecr 1493915319,nop,nop,sack 1 {3035:3104}], length 0
16:24:11.662203 IP 172.18.0.6.55310 > ec2-52-5-11-128.compute-1.amazonaws.com.https: Flags [.], seq 1587:3035, ack 5326, win 501, options [nop,nop,TS val 1493915500 ecr 4082794035], length 1448
16:24:11.662249 IP 172.17.0.1 > 172.18.0.6: ICMP ec2-52-5-11-128.compute-1.amazonaws.com unreachable - need to frag (mtu 1460), length 556
16:24:11.900648 IP 172.18.0.6.55310 > ec2-52-5-11-128.compute-1.amazonaws.com.https: Flags [.], seq 1587:3035, ack 5326, win 501, options [nop,nop,TS val 1493915739 ecr 4082794035], length 1448
16:24:11.900764 IP 172.17.0.1 > 172.18.0.6: ICMP ec2-52-5-11-128.compute-1.amazonaws.com unreachable - need to frag (mtu 1460), length 556
16:24:12.392772 IP 172.18.0.6.55310 > ec2-52-5-11-128.compute-1.amazonaws.com.https: Flags [.], seq 1587:3035, ack 5326, win 501, options [nop,nop,TS val 1493916231 ecr 4082794035], length 144
```

However, we don't see the source application ("docker pull" in this case) reacting to this msg, so it continues generating packets of the same size, and communication ultimately stalls.
